,author,published_at,updated_at,like_count,text
580,@Roughneck7712,2023-08-06T16:30:04Z,2023-08-06T16:30:04Z,0,It sucks that Netflix will likely ruin this great book
581,@CatherineLambert-fz7pd,2023-08-06T12:29:42Z,2023-08-06T12:29:42Z,1,I can't f in wait ❤
582,@Ragmon1,2023-08-06T06:22:08Z,2023-08-06T06:22:08Z,0,"From the creators of Game of Thrones.... that is a ""double-edged-sword"" kind of statement IMO."
583,@BoobaGoblin,2023-08-06T05:32:59Z,2023-08-06T05:32:59Z,1,"i watched 4 episodes of the Chinese adaptation and the visual effects are kinda bad which throws me off every time its on screen, hoping this adaptation will deliver"
584,@jtaylor5602,2023-08-05T23:11:34Z,2023-08-05T23:11:34Z,1,Dehydrate!!!
585,@rabast,2023-08-05T15:33:23Z,2023-08-05T15:33:23Z,1,"Oh, man, I just know we won't get to see <b>SPOILER FOR THE BOOK</b> the droplet attack until like S2 which will probably be in like 2025"
586,@jetsetradio7715,2023-08-05T14:19:53Z,2023-08-05T14:20:09Z,0,What brings me more despair than the books themselves is the fact an abomination like Netflix is going to adapt the series and probably ruin it with they're woke writers.
587,@patrickhenry1249,2023-08-05T05:46:37Z,2023-08-05T05:46:37Z,1,I was going to comment that at least with this series they wouldn’t have the Game of Thrones problem of having to basically write plot lines from whole cloth because the books weren’t finished yet but they had the Witcher and bungled that one too. To be fair it wasn’t DnD making it though so who knows? They at least cared about the ASoIaF series. Hopefully they do the Remembrance of Earth’s past justice too.
588,@sledgehammer5033,2023-08-05T03:07:33Z,2023-08-05T03:07:33Z,0,"WAS excited for this when it was first announced. Then I learned that D&D were behind it, now I'd rather not even get my hopes up."
589,@patman0250,2023-08-05T00:27:50Z,2023-08-05T00:27:50Z,1,"I can't really put it into words on how this book series is like. Out of all the Sci-Fi books out there, the out of the box thinking all the crazy ideas people come up with to interest you into reading their book, the three body problem is on a completely different level. The second that you thought Syfy couldn't get any more insane then comes the three body problem. This is beyond Syfy because it's just so incredibly intelligent and smart. If a savant was a book it would be the three body problem. I love that they're making this into a series but to be honest with you, there is no television series, director or CGI that is going to give this series Justice. It's just too big for the big screen to give it the Justice it deserves."
590,@SovitPoudel,2023-08-04T20:54:14Z,2023-08-04T20:54:14Z,1,I hope it would be as good as the Chinese version of the series
591,@milanfaizal,2023-08-04T18:29:41Z,2023-08-04T18:29:41Z,0,"okay, I have some pigmentation concerns"
592,@TheSealDribble,2023-08-03T18:50:50Z,2023-08-03T18:50:50Z,0,Lets see if you totally trash this book adaptation aswell
593,@luckystriker7489,2023-08-03T17:02:49Z,2023-08-03T17:02:49Z,0,Benioff and Weis failing upward.
594,@umeshkumar1379,2023-08-03T11:23:54Z,2023-08-03T11:23:54Z,1,Too see what you imagined is awesome
595,@mrp1kles,2023-08-03T06:16:23Z,2023-08-03T06:16:23Z,1,"Visuals are spot on to what I've imagined reading the book, looks promising!"
596,@Nic______,2023-08-03T05:04:00Z,2023-08-03T05:04:00Z,252,"The trilogy is amazing, going from hard sci fi into lovecraftian horror.  I hope they do it justice, and commit to all three books"
597,@haochenhuang,2023-08-03T01:45:40Z,2023-08-03T01:45:40Z,0,那么请问一下，导演，你该如何表现章北海这个人物呢？
598,@pedroaleb,2023-08-03T01:05:48Z,2023-08-03T01:05:48Z,1,christopher nolan should direct a movie based on those books
599,@CarlosGonzalez-ll6xx,2023-08-02T17:07:36Z,2023-08-02T17:07:36Z,1,"bro, why? the put white people, gringos and wakandans on this? stvpid azz gayflix and their woke s h t"
600,@woxuanli1280,2023-08-02T06:52:18Z,2023-08-02T06:52:18Z,0,It's kinda funny that they changed almost everything from the book but kept the part about the culture revolution and extend the length of it
601,@RoyLevan,2023-08-01T23:26:09Z,2023-08-01T23:26:09Z,0,Probably/Most Likely not going to live up to the books but you know what? I’ll be more than happy if they do a somewhat decent job at trying. this series is just <b>that</b> good.
602,@smb123211,2023-08-01T16:09:16Z,2023-08-01T16:09:16Z,0,"I really fear audience attention.  They can jazz it up, add loud music and trick photography but at heart this is an intellectual exercise.  Wonder if this is only the first novel."
603,@abradolflincler7506,2023-08-01T15:21:19Z,2023-08-01T15:21:19Z,0,"Knowing what these clowns did to game of thrones........ ppfffff.<br><br>Yeah they start strong and with passion, and halfway trough... they rush and rape the material to get it over with so they can make some blockbuster BS."
604,@bigmike8586,2023-08-01T08:04:15Z,2023-08-01T08:04:15Z,1,"It's gonna be trash, I already know it. Look at how they butchered Death Note, that should tell you all you need to know. Tencent already adapted Three-Body into a full series and did a phenomenal job, the episodes are free on YouTube with English subtitles."
605,@MrFunnylicious,2023-08-01T00:35:56Z,2023-08-01T00:35:56Z,0,Where is Wang Miao?
606,@eliokha,2023-08-01T00:01:58Z,2023-08-01T00:01:58Z,0,"The music is Escape! by Philip Glass, in the soundtrack for The Hours. I just figured this out by listening randomly to it wow"
607,@cameronwilson3053,2023-07-31T18:22:48Z,2023-07-31T18:22:48Z,1,"""From the creators of Game of Thrones""<br>Hey Netflix, that's not the brag you think it is. These two single handedly took a beloved series and turned it into something fans unanimously hated. Personally I'll wait to see if they bother finishing it before getting bored and rushing on to something else. Till then this doesn't even register with me and I'm a huge three body fan."
608,@cameronwilson3053,2023-07-31T00:30:17Z,2023-07-31T00:30:17Z,1,Real shame this is being made by the same people who ruined Game of Thrones.
609,@pugsan,2023-07-31T00:10:59Z,2023-07-31T00:10:59Z,0,"The Chinese series of ""3 Body"" based on the first book ""The 3 Body Problem"" was 30 episodes in it's first season. Knowing Netflix, their version will be 8."
610,@Loreto_,2023-07-30T22:56:04Z,2023-07-30T22:56:04Z,0,👏🎉👏🎉
611,@Jennifer-gc4fs,2023-07-30T21:48:06Z,2023-07-30T21:48:06Z,1,Just started the book. Im on a deadline now 😂
612,@ramyresdavid6539,2023-07-30T18:37:42Z,2023-07-30T18:37:42Z,363,"Hoping for Netflix to have a good adaption of this fascinating novel. I still recall those lines that sends chills in my spine:<br>""Do not answer!
<br>
<br>Do not answer!!
<br>
<br>Do not answer!!!"""
613,@trebot9292266,2023-07-30T18:35:54Z,2023-07-30T18:35:54Z,0,"book sounded  interesting, this movie looks really stupid."
614,@iqsta,2023-07-30T12:14:38Z,2023-07-30T12:14:38Z,0,"they will fail like always, its wokeflix"
615,@jorgeleal8010,2023-07-29T22:29:41Z,2023-07-29T22:29:41Z,1,De mis sagas favoritas de libros.. son increíbles.. Muy emocionado.. Aguante Luo Ji!
616,@unodos149,2023-07-29T16:07:35Z,2023-07-29T16:07:35Z,0,"Looks good but yeesh, these people fumbled GOT so bad in the end. Hopefully they lean against their own creative instincts and simply trust the source material to decide each path to take lol"
617,@shipecleora7682,2023-07-29T14:40:23Z,2023-07-29T14:40:23Z,0,看了一下预告片，一部中国的小说，里面全是西方世界的思维模式和剧情逻辑，非常失望，看来这部小说，不是谁都能影视化出来的，估计是个烂片
618,@RossSimmons,2023-07-29T14:36:19Z,2023-07-29T14:36:19Z,1,I don’t think ever been so excited about a Netflix series
619,@cypher1133,2023-07-28T17:35:47Z,2023-07-28T17:36:05Z,1,"Loved the first two books, but the third one, wish i could erase its memory from my head and the series would remain my fav."
620,@baolongliu6240,2023-07-28T08:49:55Z,2023-07-28T08:49:55Z,0,希望大家去看“腾讯视频”发布的  三体电视剧，非常优秀作品，非常好作品，爱来自China
621,@user-iz8oq7qz2e,2023-07-28T01:59:14Z,2023-07-28T01:59:14Z,0,别把刘慈欣的小说毁了！😂美国团队制作与中国有关的电影或电视剧我看起来都是很别扭和奇怪的
622,@samfisherxboxog8925,2023-07-27T20:24:45Z,2023-07-27T20:24:45Z,1,That beginning. Are the really going to touch on the subject of Chinas cultural Revolution?
623,@keradk,2023-07-27T18:59:33Z,2023-07-27T18:59:33Z,1,They would die if they didnt change the gender of the heroes
624,@FlanaFugue,2023-07-27T18:42:56Z,2023-07-27T18:43:50Z,0,"I really liked the book The Three Body Problem and am looking forward to this Netflix adaptation.  But I'm now reading The Dark Forest (finally) and I'm starting to have probelms with it...  (Oh no! I want it to be so good so bad)  The characters seem shallow... the plot doesn't make total sense... there's so much background exposition in every scene that one tends to forget what action and character it started off with... <br>SPOILER ALERT<br>The whole thing where Luo Ji got the perfect wife in the dream setting just to ""blow off"" the Wallfacer project was disappointing; I thought it was going somewhere, for example, this was all necessary before being able to take on the colossal endeavor of saving the world, or it was all necessary to inspire deep thought on what to do or something, or even some trick as a wallfacer, but, no... the U.N. had to manipulate him into caring?<br>Too often the story seems populated by characters imagined by an extremely cynical scientist who doesn't have much hope nor a very high regard for humans... <br>Dialogues often try to be overly clever - Characters sometimes say the opposite of what you expect only to contradict themselves a minute later, or at least say, oh wait I was wrong... it seems pointlessly confusing.<br>The Wallfacer project should be an absolute secret but the members have to submit their plans to the board for approval?<br>Are there any characters for us to actually relate to?  I know it's sci-fi and not literature but I have no idea who I am supposed to be rooting for here, if anyone...<br>Can anyone talk me back into loving this series please???"
625,@Lvxiaobu-,2023-07-27T11:12:05Z,2023-07-27T18:16:20Z,2,"<a href=""https://www.youtube.com/watch?v=5lj99Uz1d50&t=0m07s"">0:07</a>-<a href=""https://www.youtube.com/watch?v=5lj99Uz1d50&t=0m08s"">0:08</a> 对文革时期的细节把控也太不走心了，“四个伟大”只写了三个标语，这如果在当时....批斗会的负责人也会被斗死吧，中文字体用的还是21世纪才设计出来的微软雅黑（Microsoft YaHei），根本就是文革元素胡乱堆砌再一起，而且原文里叶哲泰不是在清华大学的操场上被几个中学生红卫兵批斗致死的吗.....这场景看着怎么不像"
626,@RRRusan,2023-07-27T03:04:49Z,2023-07-27T03:04:49Z,0,"Bought the book yesterday, just finished it today. Obviously, I couldn't put it down. Masterful work. But this trailer looks, meh, if I'm being completely honest. Production value is dissapointing."
627,@detectiveconan7747,2023-07-26T03:57:30Z,2023-07-26T03:57:30Z,0,"Since dan and david are doing this, I'm not gonna watch those morons work."
628,@staei7457,2023-07-25T20:32:43Z,2023-07-25T20:32:43Z,0,"They will woke it up, for sure."
629,@VaShthestampede2,2023-07-25T20:22:51Z,2023-07-25T20:22:51Z,0,"I read the book, and it was....disappointing to say the least. It was like a dollar-store sci-fi story.  The Expanse is so much of a better series, and I just don't understand what people see in this book."
630,@Cerati,2023-07-25T17:17:14Z,2023-07-25T17:17:14Z,0,"When I saw the first trailer, I was intrigued for this series, I decided to read the books. I  am half way through the first book, when I realized that Dumb and Dumber (Benioff and Weiss) from GoT are the writers for this series as well. I don't even want want to watch this now. Anybody but those two idiot writers."
631,@christian3338,2023-07-25T11:57:50Z,2023-07-25T11:57:50Z,2,Netflix is not worthy of this IP
632,@helljumper6969,2023-07-25T11:19:24Z,2023-07-25T11:19:24Z,0,Kinda nervous this is being handled by D&D
633,@MartijnMcFly,2023-07-25T11:05:45Z,2023-07-25T11:05:45Z,4,It's a good thing these books are finished.
634,@sopeszn,2023-07-25T10:29:58Z,2023-07-25T10:29:58Z,0,"I could have sworn there is already a three body problem series. I just finished episode 1. I think i saw an animated version and a film. How many three body problems are there, or have i stumbled into another dimension?"
635,@anthonybarr301,2023-07-25T05:43:04Z,2023-07-25T05:43:04Z,1,I AM YOUR WALL BREAKER
636,@thegreatwhiteleaf,2023-07-25T03:46:06Z,2023-07-25T03:46:06Z,3,My favorite book series of all time!!!! Let's go! I hope it's the whole series and doesn't just stop at the end of the first book.
637,@MrJbee1982,2023-07-25T03:03:05Z,2023-07-25T03:03:05Z,4,"ive never read the books, but I hope they make this show accessible for those like me who aren't mathematicians or physicists. I really hope it's made so that everyone can enjoy and understand it."
638,@adamscott594,2023-07-24T15:51:39Z,2023-07-24T15:51:39Z,3,Benedict Wong as Da Shi is top teir casting
639,@Djmikibg88,2023-07-24T13:32:04Z,2023-07-24T13:32:04Z,2,The book is awesome! The idea! The realistic approach to what could happen. I encourage you do read it. Something truly fresh in hard syfy ganre.  <br>Lets see what they did with the tv series.
640,@lMethode,2023-07-24T03:01:10Z,2023-07-24T03:01:10Z,0,How dare Netflix reward these talentless hacks after they destroyed any chance game of thrones not being remembered as a joke in history.
641,@DecayOfTheAI,2023-07-24T01:00:39Z,2023-07-24T01:00:39Z,2,Do whatever you want with the rest of Earth's Past... just make sure you get the YE WENJIE storyline correct. =) That's all
642,@jjdelany8130,2023-07-23T23:42:19Z,2023-07-23T23:42:19Z,0,If they couldn't give ice and fire the ebbing it deserved why would i want them to destroy another series with such great potential?
643,@yoruneko34,2023-07-23T22:32:09Z,2023-07-23T22:32:09Z,0,Let’s hope we have a stable era until then.
644,@user-hw8qp7gw5k,2023-07-23T18:16:00Z,2023-07-23T18:16:00Z,0,你好你好
645,@yoyopanda8027,2023-07-23T14:26:32Z,2023-07-23T14:26:32Z,0,王子文 peak
646,@nicthakid,2023-07-23T09:39:28Z,2023-07-23T09:39:28Z,0,I’m scared of how badly they’ll mess this up. This is my favorite story ever told and Netflix is Netflix.
647,@wenerjy,2023-07-22T23:41:18Z,2023-07-22T23:41:18Z,2,I hope this does well because I really want to see the 2nd and 3rd books adapted.
648,@XYouVandal,2023-07-22T22:24:13Z,2023-07-22T22:24:13Z,1,Cleanse all yall
649,@bhante1345,2023-07-22T17:34:27Z,2023-07-22T17:34:27Z,0,"At first I like yah, then I was like nah."
650,@davidscott506,2023-07-22T02:32:02Z,2023-07-22T02:32:02Z,0,These books are incredible. I hate to be a downer but I doubt any screen adaptation will be nearly as good.
651,@realguitarshredder,2023-07-21T23:44:35Z,2023-07-21T23:44:35Z,0,I enjoyed the chinese one. Waiting for season 2on that
652,@Ganymedical,2023-07-21T18:33:59Z,2023-07-21T18:33:59Z,1,I need this now. read the books two times as well as the audiobook xD
653,@murderyourlawn,2023-07-21T17:31:58Z,2023-07-21T17:31:58Z,0,Netflix doesn't pay actors a living wage.
654,@jenl732,2023-07-20T03:17:58Z,2023-07-20T03:17:58Z,0,from the creators of game of thrones???
655,@beeee4249,2023-07-20T00:39:45Z,2023-07-20T00:39:45Z,0,I don't get it😭
656,@ascendrio,2023-07-19T23:46:12Z,2023-07-19T23:49:20Z,0,"It will be hard to adapt the books into series, because the scale increases by magnitude with each book consecutively. Adding to that, what these guys did with ASOIAF/GOT near its climax, was horrendous frankly, and should give dread to any adaptations."
657,@santosd6065,2023-07-19T20:29:21Z,2023-07-19T20:29:21Z,0,One of the many books that became insanely popular and for the life of me I cannot see why. It seemed nonsensical and stupid to me.
658,@ilovkjd2109,2023-07-19T15:36:55Z,2023-07-19T15:36:55Z,0,"Я собираюсь читать эту книгу, что ж я в ожидании"
659,@sicthejake2400,2023-07-19T05:52:18Z,2023-07-19T05:52:18Z,2,DO NOT ANSWER<br>DO NOT ANSWER<br>DO NOT ANSWER
660,@bcrosek,2023-07-19T00:55:06Z,2023-07-19T00:55:06Z,1,I wanna see this
661,@evanbrews3867,2023-07-18T22:35:25Z,2023-07-18T22:35:25Z,1,Good trailer but you never know. Hope they do the full series because i want to see the Droplet scene
662,@brucel4378,2023-07-18T21:26:23Z,2023-07-18T21:26:23Z,2,"0'40'', that must be Wang Miao in the game, followed by a close up of him. it's a smart and safe choice to make him a westerner, but please just keep Luo Ji and Cheng Xin Chinese, then you will be fine."
663,@andresfeliperodriguezruiz1460,2023-07-18T17:20:26Z,2023-07-18T17:20:46Z,1,"I love these 3 books, i will hope netflix make this fine."
664,@SteveFoerster,2023-07-18T14:37:28Z,2023-07-18T14:37:28Z,1,"Don't cuff this up, Netflix."
665,@quincyquincy4764,2023-07-18T08:07:21Z,2023-07-18T08:07:21Z,0,"From Dan and Dave, is this going to be a problem?"
666,@braxxian,2023-07-18T01:25:36Z,2023-07-18T01:25:36Z,3,"It’s a great trailer. Let’s hope the show can live up to it, and the books."
667,@GeorgeKharaishvili,2023-07-17T20:20:29Z,2023-07-17T20:20:29Z,1,Wow great. One of the most complex sci-fi ever written to be addopted by two people who cannot read.
668,@d1ckyj0nes,2023-07-17T18:21:57Z,2023-07-17T18:21:57Z,1,"""From the creators of Game of Thrones"" That's not a merit..."
669,@MaxiBillion,2023-07-17T17:41:35Z,2023-07-17T17:41:35Z,1,CANT WAIT!!
670,@thekontessa,2023-07-17T16:09:58Z,2023-07-17T16:09:58Z,0,I love that The Hours Suite can be used for just about any movie trailer. Lol
671,@magikarpmagikarp9497,2023-07-17T14:13:05Z,2023-07-17T14:13:05Z,0,"After watching the Chinese show, can't wait for the western communism bad vuvuzela iphone gorrilion version from the yanks!!"
672,@GovMode,2023-07-17T14:04:34Z,2023-07-17T14:04:34Z,0,Don’t have any hopes for this people it’s being made by the people who wrote the end of GAME OF THRONES
673,@GovMode,2023-07-17T14:03:24Z,2023-07-17T14:03:24Z,0,Not watching it I hope it’s horrible!! The writers ruined GAME OF THRONES!! They should not be allowed anywhere near anything involved in the entertainment industry!!! David Benioff and D. B. Weiss better know as Dumb n Dumber!!
674,@sbtruestone,2023-07-17T10:39:43Z,2023-07-17T10:39:43Z,1,"<a href=""https://www.youtube.com/watch?v=5lj99Uz1d50&t=1m06s"">1:06</a> is that the Sophon experiment on Trisolaris?"
675,@kitchenheat,2023-07-17T08:16:47Z,2023-07-17T08:16:47Z,0,What did I just watch? 😅
676,@KillerKowalski_,2023-07-17T04:47:40Z,2023-07-17T04:47:40Z,1,"I watched the trailer and thought to myself 'Meh...I've heard of this series, let me check out the first book'.  Now...having read the first book and re-watching this trailer, I'm genuinely excited to see how they handle this."
677,@jt659,2023-07-17T01:28:56Z,2023-07-17T01:28:56Z,0,"I highly recommend you read this trilogy in it's original Mandarin. I tried, but I don't real Mandarin so I didn't get very far..."
678,@Kazuya720,2023-07-17T00:04:09Z,2023-07-17T00:04:09Z,1,"Okkeey.. I have NO idea so far, what it is about, but... I am interested."
679,@sleepinganimals,2023-07-16T23:04:59Z,2023-07-16T23:04:59Z,1,pushing that button gave me chills
680,@Reignor99,2023-07-16T20:49:05Z,2023-07-16T20:49:05Z,628,"this is one of the most captivating and frightening sci-fi stories I've ever read, I still think about it sometimes late at night and get chills"
681,@user-wj6wk6db6h,2023-07-16T20:41:56Z,2023-07-16T20:41:56Z,1,A neighbour got the book version for my birthday. I’m excited for the movie.
682,@Jmkosturaea,2023-07-16T15:24:29Z,2023-07-16T15:24:29Z,1,Awesome Philip Glass remix!
683,@jonas1378,2023-07-16T13:43:20Z,2023-07-16T13:43:20Z,0,I don't think it will be good
684,@stryed3483,2023-07-16T06:03:40Z,2023-07-16T06:03:40Z,0,From the creators of GoT? We're screwed :(    Saw the Chinese TV series and it started off well but really really dragged on.
685,@lindlind3859,2023-07-16T05:50:12Z,2023-07-16T05:50:12Z,1,"Damm, this looks good. Will defo check it out."
686,@Abhinavjha_,2023-07-16T05:21:22Z,2023-07-16T05:21:22Z,0,I think three body problem can't be made into good series
687,@batgirlp5561,2023-07-15T21:40:56Z,2023-07-15T21:40:56Z,1,I can't tell what it is about
688,@whirlingdurbish,2023-07-15T20:41:01Z,2023-07-15T20:41:01Z,0,"Is calling it a ""Blockbuster Series"" false advertising if you cancel it after a single season, like with 1899?"
689,@Bowkrim,2023-07-15T20:22:24Z,2023-07-15T20:22:24Z,2,"""from the creators AND destroyers of Game of thrones"". I think this show will be fine as long as it doesn't last more than 5 seasons and the source material is complete."
690,@pom4408,2023-07-15T19:40:27Z,2023-07-15T19:40:27Z,0,"So, how are they going to f** it this time (netflix, Benioff and/or Weiss) ?"
691,@sessionroadtunes,2023-07-15T09:05:16Z,2023-07-15T09:05:16Z,0,I ❤🧡💛💚 Sophon
692,@motivationmoneywellness,2023-07-15T03:13:51Z,2023-07-15T03:13:51Z,1,"i hope they pull this off, just glad its not disney making it"
693,@Slim-Thicc,2023-07-15T01:56:09Z,2023-07-15T01:56:09Z,2,I have no doubt Netflix will butcher this series beyond recognition since it’s so far above the IQ level of the common viewer.
694,@YoHoosierDaddy,2023-07-15T00:19:38Z,2023-07-15T00:19:38Z,0,I wonder what Dr. Sheldon Lee Cooper thinks about this series.
695,@JB-bq2qj,2023-07-15T00:11:49Z,2023-07-15T00:11:49Z,0,I wonder how boring can they make it
696,@fabiankempazo7055,2023-07-14T20:16:14Z,2023-07-14T20:16:14Z,0,I hope they do not screw up the tv show like they did with the trailer....and GoT...
697,@kaancoban1996,2023-07-14T19:05:33Z,2023-07-14T19:05:33Z,0,"fun fact: at <a href=""https://www.youtube.com/watch?v=5lj99Uz1d50&t=01m25s"">01:25</a> this lady (sophon) slashes her victims following the line of left shoulder to right hip with a katana. the goal is to maximize the amount of guts spilled"
698,@kaancoban1996,2023-07-14T18:47:56Z,2023-07-14T18:47:56Z,1,"sophon at the last moment gave me chills, although i'd expect her in camo suit"
699,@kaancoban1996,2023-07-14T18:46:00Z,2023-07-14T18:46:00Z,1,i am so going to hibernate until i watch this
700,@aestheticjournal5909,2023-07-14T15:38:26Z,2023-07-17T06:43:05Z,1,Man! That BWV 947 music gave me goosebumps
701,@x2946,2023-07-14T10:20:25Z,2023-07-14T10:20:25Z,0,あの壮大な物語がどの様に映像化されるのか、もう期待しか無い！
702,@mingyuhuang8944,2023-07-14T09:50:59Z,2023-07-14T09:50:59Z,164,"As a Chinese person I am super proud that this magnificent sci fi story is becoming a truly deserved adaption! It looks great. This trailer was very well made too! <br><br>This is probably the best Asian scifi story to have ever come out, alongside Evangelion."
703,@cypher1133,2023-07-14T08:37:39Z,2023-07-14T08:37:39Z,0,Sophon is already women?
704,@PDXpackrat,2023-07-14T07:12:12Z,2023-07-14T07:12:12Z,1,It's Netflix - might as well forget about it.  They will cancel after the first season.
705,@KingSwillz,2023-07-14T06:44:41Z,2023-07-14T06:44:41Z,1,Whoa? Half a year though? That's.. why make a trailer so early.
706,@wangliao1823,2023-07-14T05:46:41Z,2023-07-14T05:46:41Z,0,"Thank you for ruining another Masterpiece, Netflix"
707,@MohammadShan912,2023-07-14T05:13:45Z,2023-07-14T05:13:45Z,0,I loved the book but ngl the this trailer is not very promising but I’m hoping for the best🤞
708,@Colin-um5tz,2023-07-14T05:05:36Z,2023-07-14T05:05:36Z,1,"It looks like a combination of Star Wars, the matrix, Star Trek, MCU, terminator and inception,"
709,@user-rz4dx5ut8h,2023-07-14T03:24:25Z,2023-07-14T03:24:25Z,1,A huge piece of TRASH!
710,@champiggyfrm_pig5271,2023-07-13T21:21:54Z,2023-07-13T21:21:54Z,1,"The first book's adaptation could be okay if things go great, but I don't see how they'd ever be able to even conceptually put in images some of the things that happen in the latter parts of the story. Honestly I don't have much hope for this adaptation, and seeing the cast doesn't make things any better"
711,@ph8429,2023-07-13T18:00:22Z,2023-07-13T18:00:22Z,1,DB Weiss and Davis Benioff are the show runners so I want NOTHING to do with it.  I never forgot that last season of Game of Thrones.  It is forever seared into my memory.
712,@Corgi_Manu,2023-07-13T17:39:19Z,2023-07-13T17:39:19Z,0,Looks fake AF.
713,@jules263,2023-07-13T16:53:57Z,2023-07-13T16:53:57Z,1,Looking forward to this series. Hopefully Netflix has cast some East Asian actors who can string an English sentence together without it being forced.
714,@jahsword7,2023-07-13T16:44:13Z,2023-07-13T16:44:13Z,2,This what I’m talking bout. Real Sci-fi
715,@LeciviousPleasingsOfALute,2023-07-13T16:13:01Z,2023-07-13T16:13:01Z,2,"I see my love<br>I fly next to her<br>I present her with my gift<br>A small piece of solidified time<br>Lovely markings are carved into time<br>As soft to the touch as the mud in shallow seas<br>She covers her body with time<br>And pulls me along to fly to the edge of existence<br>This is a spiritual fight<br>In our eyes, the stars appear as ghosts<br>In the eyes of the stars, we appear as ghosts"
716,@JKSmith-qs2ii,2023-07-13T15:54:12Z,2023-07-13T15:54:12Z,0,From the creators of GoT? No thank you.
717,@GhilenPeek,2023-07-13T12:55:56Z,2023-07-13T12:55:56Z,1,"I don't recall this many non Chinese people in the book, only the military commander towards the end.<br><br>They are really changing the characters around."
