,author,published_at,updated_at,like_count,text
1788,@MrKAmsterdam,2023-06-19T21:15:56Z,2023-06-19T21:15:56Z,2,"The first 30 episodes of the chinese TV show just got uploaded on YT - this is very close on the actual novels and I can only recommend to watch. The Netflix version might have more action and violence and ""Hollywood"" than in the actual story. But I will see both."
1789,@TheTeamFreakward,2023-06-19T21:14:58Z,2023-06-19T21:14:58Z,0,From the creators of Game of Thrones... that's an instant no
1790,@jamesjohnson809,2023-06-19T21:14:45Z,2023-06-19T21:14:45Z,0,"the character named Ye Wenjie still remained Chinese, the rest are other races than Chinese. Yeah, I can smell the Netflix trying to tell us Chinese is the world of doom creator and should be exterminated."
1791,@SouthernBella,2023-06-19T21:09:59Z,2023-06-19T21:09:59Z,0,HORRY SHEET
1792,@TanThighsYum,2023-06-19T20:52:17Z,2023-06-19T20:52:17Z,0,"I think the correct caption would've been ""From the people who ruined Game of Thrones"". Those 2 plus Netflix with their recent horrible track record, no thanks."
1793,@BCBender,2023-06-19T20:40:23Z,2023-06-19T20:40:23Z,0,"So for those of us who don't know ANYTHING about this book, and have not Googled it, this is SO vague of a trailer. Give me some dystopian stock footage and some sort of philosophical quotes and I could come up with the same nonsense. I feel like I should've been a Trailer editor."
1794,@wliuify,2023-06-19T20:39:07Z,2023-06-19T20:39:07Z,2,"Wow this actually looks very promising! I was worried about the casting choice (especially since the original story is set in China with a full Chinese cast), but so far the major scenes seems to be presented well in the trailer? Although who is the lady with the sword, is she supposed to be the sophon? That would probably mean they are rearranging the plot..."
1795,@amos_bracken,2023-06-19T20:24:40Z,2023-06-19T20:24:40Z,3,"Haven't read the trilogy and not a bug sci fi guy, but as a history buff interested in the Cultural Revolution, the shots of the Struggle Sessions interested me even more than the alien stuff. Benioff wrote a well received book on the Siege of Leningrad I believe called ""City of Theives"". Ironically, the book was mentioned in The Last of Us Part II."
1796,@winterhaunt897,2023-06-19T19:38:45Z,2023-06-19T19:38:45Z,0,"""From the creators of Game of Thrones"" doesn't present the level of confidence in quality it would have 5-6 years ago..."
1797,@os1981,2023-06-19T19:35:03Z,2023-06-19T19:35:03Z,0,Cool to see George R.R. Martin is doing a streaming series after writing Game of Thrones.
1798,@samt9097,2023-06-19T19:29:15Z,2023-06-19T19:29:15Z,0,Thank you for informing us in advance who made this.
1799,@Dontlookification,2023-06-19T19:27:33Z,2023-06-19T19:27:33Z,0,As long as they didn’t write it… I’m down.
1800,@jomertomale,2023-06-19T19:18:48Z,2023-06-19T19:18:48Z,1,PLEASE NETFLIX DO JUSTICE WITH YOUR NEW BIG 3:<br>- THIS (3 BODY PROBLEM)<br>- ONE PIECE<br>- AVATAR
1801,@eruiluvatar3917,2023-06-19T19:15:59Z,2023-06-19T19:15:59Z,3,"If the series is 10% as good as the book, that's gonna be something HUGE..."
1802,@RADIOSUICIDIO,2023-06-19T19:08:15Z,2023-06-19T19:08:15Z,0,"One thing to know about this saga is that is all about existential cosmic horror cleverly disguised as pseudo hard sci-fi. It's basically game theory mentality elevated to cosmic proportions, which is super intriguing (yes, I devoured the books), but also very ideologically biased, scientifically all over the place, and kind of effed up in a personal level. I'm not saying it's propaganda, but I learned to distrust anyone who makes claims and political stances basen on a suposed ""human nature"", let alone an ""any-inteligent-life-in-the-cosmos nature"". This one is a worst-case-scenario fantasy, that then goes on with a few ""it's even worse"" turns."
1803,@Hmoob-cx4pk,2023-06-19T18:53:57Z,2023-06-19T18:53:57Z,0,坦白说这支预告片让我感到失望😞
1804,@Just.Dad.Things,2023-06-19T18:47:48Z,2023-06-19T18:47:48Z,1,"I'm a little confused about ""the japanese lady with the katana"". Isn't she supposed to be in the second book?? Also the mashup of characters that are not true to the books is off putting. The Chinese show had it's pacing issues but was faithfull all the way, this is already up to a rough start with a ""diverse cast""...I recommend the Tencent series, watch it first, it's the real deal. The fanfic version of D&D can come later"
1805,@tonysuthechineseguy,2023-06-19T18:35:33Z,2023-06-19T18:35:33Z,1,they didnt get natalie portman to play the MC?
1806,@holabuenastardes7899,2023-06-19T18:34:30Z,2023-06-19T18:34:30Z,0,Epic trailer. Awaiting this adaptation!!
1807,@opticnurvy,2023-06-19T17:56:34Z,2023-06-19T17:56:34Z,1,Looks terrible. The Chinese series is superior
1808,@phenix1947,2023-06-19T17:48:27Z,2023-06-19T17:48:27Z,0,Wait - WHICH creators of Game of Thrones??
1809,@ZidaneA,2023-06-19T17:48:04Z,2023-06-19T17:48:04Z,0,Dodgy VFX as usual from Netflix :( They're gonna ruin this masterpiece...
1810,@dustinbeach9910,2023-06-19T17:47:07Z,2023-06-19T17:47:07Z,0,....from the creators of Game of Thrones: Season 8
1811,@mattinacan,2023-06-19T17:40:38Z,2023-06-19T17:40:38Z,0,"no thanks, I saw season 6,7&8 of game of thrones"
1812,@sideriteadamantium4300,2023-06-19T17:36:38Z,2023-06-19T17:36:38Z,0,"Watching this trailer is not giving me hope. Looks like a hard pass for me. Removing all the important Chinese male characters is textbook whitewashing. Not to mention it looks like they are casting Wenjie as ""angry"" rather than a deep and complicated character. If any of you want a good adaption, just watch Tencent's version. It already have 30 episodes and captures the book's essence very well."
1813,@elracraft,2023-06-19T17:28:40Z,2023-06-19T17:28:40Z,0,From the Enders of Game of Thrones :3
1814,@BossFinale,2023-06-19T17:26:00Z,2023-06-19T17:26:00Z,0,Zhang Beihai
1815,@linnchut3126,2023-06-19T17:24:29Z,2023-06-19T17:24:29Z,0,Ok D & D. Don't throne this up!
1816,@eternalwisdom7164,2023-06-19T17:23:59Z,2023-06-19T17:23:59Z,0,This looks trash been in produticon since 2021
1817,@shanukumar7758,2023-06-19T16:41:59Z,2023-06-19T16:41:59Z,0,The trailer looks promising
1818,@coleman7931,2023-06-19T16:33:17Z,2023-06-19T16:33:17Z,0,Let’s gooooo
1819,@sigurdkaputnik7022,2023-06-19T16:30:44Z,2023-06-19T16:30:44Z,0,"Great and interesting book and hopefeully a great series. Let's hope this Netflix show drops a hint about Cixin Liu's open support for Uyghur segragation, incarcaration and Xinjiang internment camps."
1820,@JamesKellyWickerman123,2023-06-19T16:18:16Z,2023-06-19T16:18:16Z,0,"I wonder how this will compare to the already released Chinese series ""Three Body."" They already did a great job adapting the book for that show."
1821,@danielvanderwielen912,2023-06-19T16:16:08Z,2023-06-19T16:16:08Z,0,It keeps getting better all the time! This one i want to see!! Keep it up netflix!👍
1822,@matthewharrison1494,2023-06-19T16:08:44Z,2023-06-19T16:08:44Z,2,This is bound to be the largest scale sci-fi story ever filmed
1823,@matthewharrison1494,2023-06-19T16:06:02Z,2023-06-19T16:06:02Z,0,I’m surprised this trailer hasn’t gotten more views yet
1824,@cormacson,2023-06-19T16:03:13Z,2023-06-19T16:03:13Z,1,Netflix - JUST FOLLOW THE BOOK.     Thats all  you need to do. Dont screw up it.
1825,@gusespinel,2023-06-19T15:53:09Z,2023-06-19T15:56:18Z,3,"Oh man, is that Sophon in the first season? This just tells me the series is not gonna be too close to the books. But im not gonna lie, I am SUPER exited to see Netflix adaptation."
1826,@samgfraser,2023-06-19T15:51:00Z,2023-06-19T15:51:00Z,0,"Is it English or dubbed?  I can’t stand watching dubbed videos, the mouth not matching the audio ruins it for me."
1827,@victorw.330,2023-06-19T15:46:33Z,2023-06-19T15:46:44Z,0,I’d have so much for confidence if Netflix and D & D weren’t doing this show!
1828,@weiliao7642,2023-06-19T15:41:47Z,2023-06-19T15:41:47Z,3,"For hard sci-fi, it's usually difficult to visualise the story. This is especially true for 3 Body Problems. I hope Netflix can do an OK job (I don't have high hope)."
1829,@crashleykelsey8532,2023-06-19T15:40:07Z,2023-06-19T15:40:07Z,2,"I really enjoyed the book series. I found it interesting that to me, the characters are not nearly as important is the story itself. The main characters are the cultures involved."
1830,@cloogshicer,2023-06-19T15:38:30Z,2023-06-19T15:38:30Z,0,"After Game of Thrones Season 8, I can't help but think they'll screw it up."
1831,@julygirl9995,2023-06-19T15:30:29Z,2023-06-19T15:30:29Z,0,Hope this is good. Already an adaptation of the book came out this year. Lets see
1832,@prattattak,2023-06-19T15:28:46Z,2023-06-19T15:28:46Z,0,"Wait, <b>which</b> creators of Game of Thrones?"
1833,@CarlBramhall,2023-06-19T15:19:31Z,2023-06-19T15:19:31Z,2,Knowing the books and hearing Carl Sagan's words brought a shiver to me!
1834,@ickysnowman,2023-06-19T15:18:41Z,2023-06-19T15:18:41Z,4,I hope asian actors actually get represented in this and not get whitewashed
1835,@bts_army799,2023-06-19T15:14:07Z,2023-06-19T15:14:07Z,0,Why this series name is 3 body problem?
1836,@hjlee2478,2023-06-19T15:13:24Z,2023-06-19T15:13:47Z,0,"ye wenjie's emotion completely wrong, she is hoping for some help, not hoping for a disaster"
1837,@cakesir,2023-06-19T14:47:05Z,2023-06-19T14:47:05Z,0,It's an ad for the Vision Pro? 😂
1838,@gregthomas050279,2023-06-19T14:42:37Z,2023-06-19T14:42:37Z,0,DEHYDRATE!
1839,@opasailor,2023-06-19T14:35:30Z,2023-06-19T14:35:30Z,0,ALL HAIL TRISOLARIS!
1840,@funkmasterkirk,2023-06-19T14:29:01Z,2023-06-19T14:29:01Z,0,"""From the same people that RUINED Game of Thrones."" - No Thanks"
1841,@gt4666master,2023-06-19T14:26:59Z,2023-06-19T14:26:59Z,1,Reading this in my recommendations gave me goosebumps. Reading 3bp was a milestone in my life.
1842,@Juniper-111,2023-06-19T14:14:19Z,2023-06-19T14:14:19Z,1,what the hell is up with all the fire?
1843,@Juniper-111,2023-06-19T14:13:14Z,2023-06-19T14:13:14Z,1,from the creators of game of thrones...
1844,@Paul-ft9dn,2023-06-19T13:56:24Z,2023-06-19T13:56:24Z,6,"always hoped theyd make it into a tv show ever since reading the books, cant wait"
1845,@banyiyi2376,2023-06-19T13:46:21Z,2023-06-19T13:46:21Z,0,waaaaaaaa！
1846,@Stampio2K,2023-06-19T13:31:42Z,2023-06-19T13:31:42Z,2,Nice... finished the book a few months ago
1847,@kuruw,2023-06-19T13:29:53Z,2023-06-19T13:29:53Z,0,Lockheed martin eats souls
1848,@cccspwn,2023-06-19T13:27:23Z,2023-06-19T13:27:23Z,2,They replaced a lot of the Asian Male characters with white and black actors…not sure how I feel about that
1849,@spazzdineveryway,2023-06-19T13:18:27Z,2023-06-19T13:18:27Z,14,just read the synopsis.  this sounds like absolutely mind blowing.  I hope it’s close to the material or true to its intent
1850,@Lp-ze1tg,2023-06-19T13:15:04Z,2023-06-19T13:15:04Z,0,3 body problem itself is a problem.<br>Who was the original author of the book?
1851,@Ateshtesh,2023-06-19T13:08:25Z,2023-06-19T13:08:25Z,0,Why just dont take the original series and just subbed and dubbed it?<br>Why they need to re-make it?
1852,@LandofNagas,2023-06-19T13:05:35Z,2023-06-19T13:05:35Z,0,Ong..Ong..Ong..Ong..
1853,@joseriffo,2023-06-19T12:50:34Z,2023-08-15T18:55:34Z,0,The soundtrack is amazing.
1854,@eamonreidy9534,2023-06-19T12:41:57Z,2023-06-19T12:41:57Z,0,I didn't know they were making this!!! Omg 🥰🤩
1855,@TheTheDoctorWho,2023-06-19T12:39:53Z,2023-06-19T12:39:53Z,1,Music name? it's perfect!
1856,@9akashnp8,2023-06-19T12:23:18Z,2023-06-19T12:23:18Z,1,Is that carl sagans voice?!
1857,@marinevast,2023-06-19T12:14:57Z,2023-06-19T12:14:57Z,1,Maybe I will subscribe to Netflix for this
1858,@soulsbored6144,2023-06-19T12:11:15Z,2023-06-19T12:11:15Z,1,Looks great. Cant wait to not see its second season.
1859,@shargrim1,2023-06-19T12:06:32Z,2023-06-19T12:06:32Z,2,Починайте читати трилогію вже. Це буде неперевершений серіал.
1860,@TheNotoriousBTG,2023-06-19T12:05:26Z,2023-06-19T12:05:26Z,1,"<a href=""https://www.youtube.com/watch?v=5lj99Uz1d50&t=1m10s"">1:10</a> Anyone else think she kinda looks like Nishikiyama in Yakuza 1?"
1861,@serious_crab,2023-06-19T12:05:02Z,2023-06-19T12:05:02Z,1,I hope they show everything like in the book
1862,@samuelhorwood,2023-06-19T12:03:22Z,2023-06-19T12:03:22Z,3608,Never been as excited or as nervous for a tv series. If they do the books justice we’re in for a treat.
1863,@enzob95,2023-06-19T12:02:44Z,2023-06-19T12:02:44Z,1,"The books were pure cocaine, don't mess this up."
1864,@SirAsdf,2023-06-19T12:01:55Z,2023-06-19T12:01:55Z,0,This seems like the kind of Sci-Fi that's going to cause my eyes to glaze over.
1865,@BrasilPopular,2023-06-19T11:58:30Z,2023-06-19T11:58:30Z,1,"The demonization of communism with the apparent execution scene is ridiculous and isn't part of the story. <br>But even with that aside, so far the Tencent version of the series still seems better."
1866,@monstahslayah,2023-06-19T11:54:02Z,2023-06-19T11:54:02Z,0,This looks pretty cool... oh from the creators of Game of Thrones. Nevermind.
1867,@prasenjit134,2023-06-19T11:50:06Z,2023-06-19T11:50:06Z,32,"Wow, this looks fabulous. While reading the 1st book, i was wondering if anyone could make a visual of what all Liu Cixin made us imagine in our head. This looks promising,  could not have come from a better creator. Looking for a visual treat . I really hope it does justice to the trilogy and hope it goes till Death's end <3 ."
1868,@HNRWANG,2023-06-19T11:49:03Z,2023-06-19T11:49:03Z,0,can't wait!
1869,@whonose8472,2023-06-19T11:46:32Z,2023-06-19T11:46:32Z,2,Does anyone know the music used in this teaser? It's beautifully epic!
1870,@ThePatent01,2023-06-19T11:15:46Z,2023-06-19T11:15:46Z,97,"I’ve been waiting so long for this!!! Finally, we have a release date! No doubt this series is going to be epic. The books are the golden standard of sci-fi, the on-screen adaptation likely will fall short in places but I’m sure will be good in its own right. I can’t say enough good things about these books! I’ve been craving more ever since I turned the last page years ago!"
1871,@justmikachannel,2023-06-19T11:02:36Z,2023-06-19T11:02:36Z,0,Ayoooo for real
1872,@trixielangford9085,2023-06-19T11:00:35Z,2023-06-19T11:00:35Z,0,There is also chinese drama with the same name and based off same book i think.
1873,@xshepd723,2023-06-19T10:38:56Z,2023-06-19T10:38:56Z,1,文革部分好好拍，我爱看😂
1874,@gg-ny9ns,2023-06-19T10:34:07Z,2023-06-19T10:34:07Z,1,文革的部分一定要拍出来啊<br>然后国内就封杀 🎉
1875,@slick3336,2023-06-19T10:33:42Z,2023-06-19T10:33:42Z,0,Do is this like a dragon ball z meets the dark tower sort of thing?
1876,@philafx82,2023-06-19T09:40:42Z,2023-06-19T09:40:42Z,1,Sagan ❤
1877,@Omiicron,2023-06-19T09:39:59Z,2023-06-19T09:39:59Z,0,"Awesome, another good franchise for Netflix to cancel on us. Looking forward to it."
1878,@philafx82,2023-06-19T09:39:48Z,2023-06-19T09:39:48Z,3,Literally just finished Deaths End. Phenomenal series
1879,@peter6850,2023-06-19T09:33:36Z,2023-06-19T09:33:36Z,0,Creators of Game of Thrones... Shit!
1880,@mfshro0m,2023-06-19T09:17:59Z,2023-06-19T09:17:59Z,14,So Netflix replaced all the Asian male main characters with white and black guys and kept the asian women. This refusal to cast asian men in lead roles while fetishising asian women is absolutely sickening. F* Netflix. This is unacceptable
1881,@the_real_kevin8996,2023-06-19T08:50:23Z,2023-06-19T08:50:23Z,1,woah this show is woke and crap just as I expected
1882,@zinkboltwanton8197,2023-06-19T08:25:34Z,2023-06-19T08:25:34Z,5,"from the trailer, I see only hate in Ye Wenjie’s eyes. Her emotions are much complex than just hate, she is beyond hate or love. I hope the series show the complicated context of that part of Chinese history, not just “the protagonist had a dark past from a dark country, but he/she had a dream of science/freedom.” <br>I watched the CN version Three Body Problem tv series, the effects are a bit old but very much on point, acting is fantastic. <br>So far, I can’t feel the Ye Wenjie from the book: a girl tortured by emotions, politics and society. The trailer showed me a girl with hate and fire, not “understanding” from a grand scale."
1883,@jockeb2651,2023-06-19T08:14:17Z,2023-06-19T08:14:17Z,0,It will be nice to compare it to the Chinese version of 30 episodes. It was so great. I do not believe netflix can beat it
1884,@maxbobo3904,2023-06-19T08:07:15Z,2023-06-19T08:07:15Z,0,"Not so good, the chinese version is out already, looks better than this"
1885,@Hoyte-ub9ws,2023-06-19T07:54:48Z,2023-06-19T07:54:48Z,0,looking forward from china!
1886,@MrYsosad,2023-06-19T07:52:44Z,2023-06-19T07:52:44Z,0,"nah, another westoid white washed cheap copy. I will check the Tencent faithful adaptation"
1887,@hitokiri13,2023-06-19T07:52:02Z,2023-06-19T07:52:02Z,0,"why would you brag about being from creators of GoT ? If anything, that's a red flag. And not a chinese workers red flag"
1888,@mortichro,2023-06-19T07:45:10Z,2023-06-19T07:45:10Z,1,Benedict Wong playing as Shi Qiang?<br><br>YES PLS
1889,@Jezaja,2023-06-19T07:43:45Z,2023-06-19T07:43:45Z,0,"If you have the chance, watch the chinese original show first."
1890,@GeekFurious,2023-06-19T07:43:25Z,2023-06-19T07:43:25Z,1,"In some ways it looks like the Chinese series (though, way more Western actors). But I know one thing it will do better: it won't have 30 episodes to tell a 10 episode story! I mean... I could have easily gone from episode 8 to episode 28 and barely missed anything of importance."
1891,@VictoriNoRisuu,2023-06-19T07:43:21Z,2023-06-19T07:43:21Z,0,"I only read the first book, but I didn't like it - the story and the scifi concept was very interesting, but the characters remained so generic and underdeveloped I couldn't care less about them... So I gave up on the books, but I still may give the Tv series a shot. Maybe it will give the characters a bit more life..."
1892,@captainharlock31,2023-06-19T07:37:10Z,2023-06-19T07:37:10Z,0,"I wonder, do we really need this after Tencent's great series ""Three Body"". It looks funny, because it's very Chinese book about Chinese people, so the cast looks weird.<br><br>As we can see there will be scenes from cultural revolution, meh"
1893,@vidyaabhimaan,2023-06-19T07:36:34Z,2023-08-01T15:31:44Z,0,For all those who are excited do not forget it is the worse duo in Hollywood history running this show. Remember what they did GOT ? this will be no different. Personal ideology beats integrity of the source material for these idiots who themselves cannot write shit.
1894,@user-bt5wq2cj6g,2023-06-19T07:34:33Z,2023-06-19T07:34:33Z,0,"<a href=""https://www.youtube.com/watch?v=5lj99Uz1d50&t=0m08s"">0:08</a> RED BOOK REPLACING ALL ANCIENT CHINIZ CIVILIZATIONS WISDOMS & THINKERS AND BURNING MOST OLD SCRIPTURES AND EVEN REPLACING THE TRADITIONAL CHINIZ CHARACTERS - THAT IS THE 1ST AWAKENING OF RED DRAGON. FAST FORWARD TO 80S-90S THE MASSACRE OF TIAN AN MEN REVOLUTION & THE RETURN OF LOST CHILDREN (HK, MACAO & CRAZY RICH SOUTH EAST CHINIZ ASIANS) - THAT IS THE 2ND AWAKENING. WHEN CHINA TAKES OVER USA AND THE WEST TO BE THE RICHEST NAZION... NO ONE CAN STOP THE AWAKENING OF RED DRAGON ITSELF... THE TONY SA TAN OF SODOM GOMMORAH SG. THE END OF FREEWILL IS NIGH."
1895,@iphatbass,2023-06-19T07:29:16Z,2023-06-22T10:14:53Z,0,"This is awesome series, too bad Netflix will butcher it as usual.... Can't wait for changes after changes! I guess you can't beat Chinese version, so you will try to make your ""unique"" abomination, like you did with the all other shows."
1896,@sakura7431,2023-06-19T07:25:33Z,2023-06-19T07:25:33Z,0,VFX is kinda cheap tho.....
1897,@beautifulloser8074,2023-06-19T07:21:59Z,2023-06-19T07:21:59Z,0,The cast list makes this awesome.  😮
1898,@drayniii,2023-06-19T07:15:46Z,2023-06-19T19:34:52Z,3,"Replace all the Asian men with other ethnicities, keep all the Asian women in, loooool. Whitewashing in 2023"
1899,@Kingsta2000,2023-06-19T07:04:57Z,2023-06-19T07:04:57Z,2,Can't wait to see what the Trisolatans 'Alien invaders' look like...
1900,@eyoutube1,2023-06-19T06:53:29Z,2023-06-19T06:53:29Z,0,It looks true to the book series
1901,@grelkie,2023-06-19T06:51:58Z,2023-06-19T06:51:58Z,0,i wonder how D&D will end up rushing and ruining this project for another
1902,@matt-os4ym,2023-06-19T06:44:24Z,2023-06-19T06:44:24Z,0,I have a feeling this will be a big ole flop
1903,@aulendor4639,2023-06-19T06:37:23Z,2023-06-19T06:37:23Z,0,"Не читавшему книги зрителю трейлер даёт примерно около нуля понимания про что на самом деле будет сериал.<br>Хотя, это же нетфликс. Тут и читавшие книгу понятия не имеют про что окажется сериал."
1904,@acouragefann,2023-06-19T06:33:10Z,2023-06-19T06:33:10Z,0,"The person in the last scene indicates they were either stupid, and took ""swordholder"" literally, or smart and made the ambassador a major  representative character"
1905,@Alekseyo,2023-06-19T06:26:33Z,2023-06-19T06:26:33Z,0,The clown show runners fooled us once. Easy pass
1906,@user-pb5pw2tj3l,2023-06-19T06:20:34Z,2023-06-19T06:20:34Z,1,希望网飞可以摒弃美式个人英雄主义，还原一个真实的三体宏大世界观
1907,@TheFourthWinchester,2023-06-19T06:16:56Z,2023-06-19T06:16:56Z,1,I hope Dumb and Dumber actually adapt all of the story this time and don't try to bring in their own stupid ideas to ruin it forever.
1908,@funnytastingmilk,2023-06-19T06:16:33Z,2023-06-19T06:16:33Z,2,"Tencent already has 30 episodes of their version, Netflix late to the game"
1909,@jed6780,2023-06-19T06:12:15Z,2023-06-19T06:12:15Z,1,"So...I'm supposed to once again invest lots of time and energy buying into this world only for the showrunners to grow tired of it, despite the network and author begging them to develop a proper ending, and be left with a sloppy ending that makes the entire story meaningless in hindsight? No thanks."
1910,@sepi477,2023-06-19T06:00:11Z,2023-06-19T06:00:11Z,1,"I dunno, looks quite bad. Those 2 lads aren't known to push anything good out by themselves anyways"
1911,@AbdielManuel,2023-06-19T05:43:31Z,2023-06-19T05:43:31Z,0,"I read the book and saw the Chinese adaptation, the book were great,  the Chinese adaptation, not so great, The book it’s really difficult to adapt, I just hope the Netflix adaptation make a better work then then Chinese one."
1912,@melvinstarita,2023-06-19T05:28:32Z,2023-06-19T05:28:32Z,0,From the creators of game of thrones this better be great!
1913,@tiamzy,2023-06-19T05:24:24Z,2023-06-19T05:24:24Z,0,Using a rendition of Philip Glass’ “The Hours” theme in this trailer is chef’s kiss
1914,@Chak666,2023-06-19T05:23:12Z,2023-06-19T05:23:12Z,0,Thou shalt not f**k this up D&D...
1915,@thatguybutitsactuallyagirl5384,2023-06-19T05:01:47Z,2023-06-19T05:01:47Z,0,What is it  about exactly?
1916,@leothelion6075,2023-06-19T04:52:48Z,2023-06-19T04:52:48Z,5,"LOL looks the Netflix killed off all the Asian male characters from the novel before the Trisolarians got to them<br><br>Gonna pirate the fuk outta this,  no way giving a dime to NFLX"
1917,@amadexi,2023-06-19T04:49:42Z,2023-06-19T04:53:35Z,5,Looks quite whitewashed... Why is netflix/western media often racist and trying to erase asian men? Obviously they kept a few asian women for the fetish.
1918,@despirdzhang3225,2023-06-19T04:39:26Z,2023-06-19T04:39:26Z,2,was that cool girl Sophon? she looks awesome
1919,@ginanjarbs1395,2023-06-19T04:27:26Z,2023-06-19T04:27:26Z,4,"""From the creators of game of thrones"" lmao they choose to put these hacks instead of mentioned the author of the book"
1920,@maxthepupp,2023-06-19T04:25:57Z,2023-06-19T04:25:57Z,2,Ugh....have to wait until January?!?
1921,@V_ii,2023-06-19T04:21:19Z,2023-06-19T04:21:19Z,1,"I'm really into the more Cyberpunk type of Sci-fi, but am open to most sub-genre's or perspectives of it than just that one type. I'd love to get some in depth opinions about the books for this Trilogy. I could go for a good Sci-Fi read. <br><br>Also, if anyone has some suggestions on Cyberpunk-esque reads (I've probably read most of the more well known titles) feel free to share."
1922,@ensaladadepapaya8511,2023-06-19T04:20:26Z,2023-06-19T04:20:26Z,1,Now I don't know if I should watch this or the Tencent one
1923,@eden20111,2023-06-19T04:09:53Z,2023-06-19T04:09:53Z,2,This is gonna get cancelled after one season watch… look what happen to 1899. Such an underrated masterpiece and gets cancelled.
1924,@Chelseazhou,2023-06-19T04:04:15Z,2023-06-19T04:04:15Z,1,"Looking pretty good so far, hope it will have high quality production and acting as GOT. And I am concerning about the conversation in Chinese, hope it would sound native."
1925,@bretweinshank5816,2023-06-19T03:57:46Z,2023-06-19T03:57:46Z,0,"<a href=""https://www.youtube.com/watch?v=5lj99Uz1d50&t=0m22s"">0:22</a> oh f*ck me"
1926,@mrx1333,2023-06-19T03:56:24Z,2023-06-19T03:56:24Z,0,"This looks like an anthology series! Looks really good, I'll be watching this for sure!"
1927,@milktontam3155,2023-06-19T03:54:03Z,2023-06-19T03:54:03Z,1,"As a Chinese, I think the Tencent ver THREEBODY had won already."
1928,@bretweinshank5816,2023-06-19T03:52:48Z,2023-06-19T03:52:48Z,2,"As someone who hasn’t read the books, this trailer is not intriguing, utterly confusing, and will not motivate me to watch the show. <br><br>Also, not sure about the logic behind Netflix’s decision to give $200 mil each to D&D after the disastrous GOT ending. Guess I’m in the wrong business"
